,Name,LineA,LineB,LineC,Concatenated
5436,Phil ," This thing is really loose. I'm gonna go grab a screwdriver, but you run with this. On your mark, get set, Van Gogh!",,,
5437,Luke ," Hey, dad. He kind of looks like uncle Mitchell, if uncle Mitchell were insane.",,,
5438,Mitchell ,, Aah! I got sprayed by a skunk!,,
5439,Jay ," Oh! Ugh! Oh, you stink.",,,
5440,Manny , And not just at astronomy! Blammo!,,,
5441,Mitchell , What is happening?,,,
5442,Cameron , I love this place.,,,
5443,Gloria ,, I...love...this place.,,
5444,Cameron ," I...Was...Nervous. I mean, there was a lot of different food on the menu. And on the floor. And on the wall. ",,,
5445,Mitchell , Are we -- are we sure we're not exaggerating just a little bit?,,,
5446,Cameron ," Were you there, Mitchell? Because I think I would've recognized the only other white or gay person. I had already offended Gloria once. Not gonna do it again. ",,,
5447,Mitchell ," You sure, dad? You're -- you're not worried I might stink up the blanket?",,,
5448,Jay , Don't worry about it. We just use it to cover up the seat for when Manny's all sweaty after his tango class.,,,
5449,Manny ," If you don't sweat, you're not doing it right. ",,,
5450,Waiter , Hello. ¿Como esta? Gloria! Desde hace mucho que no vienes.,,,
5451,Gloria ," Mi amigo, Cameron.",,,
5452,Waiter ," Oh, welcome. So, carnitas diablos?",,,
5453,Gloria ," Ah, you remember!",,,
5454,Cameron ," Uh, I'll just have the same thing.",,,
5455,Waiter ," No, no, no, no, no, you should have the chicken enchiladas. Mm-hmm.",,,
5456,Cameron ," Uh, no, I'll have the carnitas diablos.",,,
5457,Waiter , These are not for you.,,,
5458,Cameron , Excuse me? They're too spicy.,,,
5459,Waiter , And this girl is used to it.,,,
5460,Gloria ," Yeah, he's right.",,,
5461,Cameron ," I can spice you under the table any day. There, sweet thing. Dos carnitas diablos, por favor.",,,
5462,Waiter , Okay.,,,
5463,Gloria , Okay. ,,,
5464,Gloria ," So, he was one of the best boyfriends I ever had.",,,
5465,Cameron , But he was gay.,,,
5466,Gloria ," Yeah, I figured that out after the first month, But I stayed for a whole year because the haircuts were fantastic! It's funny, huh? Cameron, come on, it's not that funny. Are you okay?",,,
5467,Cameron , I'm fine.,,,
5468,Gloria , Are you sure?,,,
5469,Cameron , I love this place.,,,
5470,Gloria , But your head is running water.,,,
5471,Cameron ," No, I don't think it is.",,,
5472,Gloria , I told you it was too spicy for you! Look at your shirt!,,,
5473,Cameron ," No, I just need to get a little bit of a drink of something.",,,
5474,Gloria ," No, no, no, no, no. Cameron, the water makes it so worse. No!",,,
5475,Cameron ," Oh, you're right. That does make it worse. I feel like I ate the sun! ",,,
5476,Jay , Mitchell.,,,
5477,Mitchell ," Of course. What was I thinking? Dad, can we -- can we just go home, please?",,,
5478,Jay , You've got to air out first before I let you in that car. I'll never get the stink out.,,,
5479,Manny ," Hey, Jay, is that Venus? 'Cause I can smell the clouds of pure sulfuric acid from here. Slam!",,,
5480,Mitchell ," Okay, I-I -- I'd really like to go home now.",,,
5481,Manny , We'll miss the meteor shower.,,,
5482,Jay , The trouble is your clothes. Just take them off. I think there's a blanket in the trunk. ,,,
5483,Claire , And that is the secret to no lumps. See? It's kind of fun.,,,
5484,Haley ," You make it fun, mom.",,,
5485,Claire , Mmm.,,,
5486,Alex , Listen to these symptoms of ADHD and tell me it's not Luke.,,,
5487,Claire , Alex.,,,
5488,Alex ," ""Easily distracted by irrelevant stimuli.""; ""Often impulsively abandons one task for another.""",,,
5489,Phil , That's where I left those.,,,
5490,Alex ," ""A tendency to act without regard to consequences, often at the expense of personal safety.""; ""having accidents more often… "" ",,,
5491,Claire ," Okay, you know what? I think that that's enough, Alex. We've… we've got it.",,,
5492,Phil ," Okay, no. No.",,,
5493,Claire ," Phil? Phil, honey, are you okay?",,,
5494,Phil , Yeah. Remember those sunglasses I couldn't find? Bingo!,,,
5495,Claire , I asked you to do one thing stay on top of Luke.,,,
5496,Phil ," For your information, your son is hard at work on an awesome Van Gogh - got to fix that… masterpiece. Wait till you see. You're gonna be so surprised.",,,
5497,Claire ," Oh, god, honey, I want nothing more than to be surprised, really. Oh. I'm not surprised. Okay, that's it. I don't want to hear anything about your new method of doing things. There's one thing that works with these kids, And that is staying on top of them, Which, thanks to you, my friend, I will now be able to do all night long.",,,
5498,Phil ," Not happy, dude. You're supposed to be working.",,,
5499,Luke , I am working.,,,
5500,Phil , Mr Potato Head? Really?!,,,
5501,Luke ," I know what you think, but...",,,
5502,Phil ," No, I don't want to hear it. I'm going down to clean up the garage. Then I'm coming back, and I'm gonna stand over you Until this thing is done, okay?",,,
5503,Gloria , Breathe.,,,
5504,Cameron , Breathing only makes the fire spread.,,,
5505,Gloria ," Okay, then drink this milk. Ay, Cam! Why did you have to order that spicy dish?",,,
5506,Cameron ," Because I'm… I'm a big idiot. And I wanted to have this awesome night Between the two of us, Where we end up best friends, Uh, having lunch, buying shoes.",,,
5507,Gloria , Okay! Let's go have lunch! Let's go buy shoes!,,,
5508,Cameron , Really?,,,
5509,Gloria ," Yeah, why are you so surprised? ",,,
5510,Cameron ," I don't know. I guess I just always feel like I-I blow it with you, Gloria. Whether it's the Colombian comment Or picking the wrong restaurant…",,,
5511,Gloria , The restaurant? That had nothing to do with you. I was just not in the mood to go anywhere that fancy after the stupid thing I did this morning.,,,
5512,Cameron , What did you do?,,,
5513,Gloria , I bought a dress.,,,
5514,Cameron , You monster.,,,
5515,Gloria ," It was a very expensive dress that I don't need. I felt so stupid that when I got home, I couldn't even bring it inside the house. I left it in the car.",,,
5516,Cameron , I totally get it. I have a legendary hat story. I'll bet you look fabulous in that dress.,,,
5517,Gloria ," Yes, but anyone would look fabulous in at dress.",,,
5518,Jay , You find that blanket?,,,
5519,Mitchell , No. This was all I could find. Shut up!,,,
5520,Jay , Really shows off your shape.,,,
5521,Manny ," Okay. Spin around, cupcake. Let's see the caboose.",,,
5522,Jay , you get fries with that shake? Was that too far?,,,
5523,Manny ," There's a line, Jay.",,,
5524,Jay , I better go mop this up.,,,
5525,Mitchell ," Oh, come on. Where's the...",,,
5526,Jay ," I'm sorry if things got a little out of hand back there, But in our defense, look at you. I mean, smell you.",,,
5527,Mitchell , This is a fantastic apology.,,,
5528,Jay ," Oh, don't be too hard on the kid. I was egging him on. If you're gonna be mad, be mad at me.",,,
5529,Mitchell , Done.,,,
5530,Jay ," I was just happy to see him laugh a little bit. You know, he's had kind of a tough week.",,,
5531,Mitchell ," I got sprayed by a skunk, And I'm wearing a dress that makes my hips look huge. ",,,
5532,Jay ," I know he doesn't want me to talk about it, But he didn't get invited to this big party. Some kids he thought were his friends think he's weird. Now, you know me on this. I'm no -- I'm no good at it, you know? I-I never know what to say.",,,
5533,Mitchell ," Well, that's true.",,,
5534,Jay ," But maybe I raised a kid who would know what to say. Now, that's the only reason I invited him along, You know, because this astronomy stuff that's -- that's our thing.",,,
5535,Mitchell ," Yeah, no, I'll -- I'll talk to him.",,,
5536,Jay ," You know, you don't look that ridiculous. Now, you -- you actually got the legs for it.",,,
5537,Mitchell ,," No, I'm just saying, if you were that type of a gay...",,
5538,Mitchell , Dad!,,,
5539,Jay , ...You'd probably do all right for yourself.,,,
5540,Mitchell , Come on!,,,
5541,Cameron ," You know, I always had a sense it was dangerous down here, But I guess it's actually kind of charming, isn't it?",,,
5542,Gloria ," No, it's not safe at all. I used to live down here, you know?",,,
5543,Cameron , What?,,,
5544,Gloria ," Yeah, that's why I come down here. Look there. That was my old apartment. After I left Javier, that's all I could afford. It's still part of me. You have to remember those things. You do. Like you when you go to your farm.",,,
5545,Cameron , You remember that? I told you that a year ago.,,,
5546,Gloria ," Of course I do. You're my friend, you big idiot! You know, this part of town might be very rough, But the people here, Cameron... the best.",,,
5547,Cameron , I'm pretty sure I had wheels when I parked here.,,,
5548,Gloria , Ay-yi-yi! Who did this?!,,,
5549,Cameron ," Oh, no, it's okay, Gloria.",,,
5550,Gloria , Who did this? ! You coward sons of bitches!,,,
5551,Cameron ," It's okay, everybody! I'm - I'm insured!",,,
5552,Gloria ," What? You scared?! You scared to show your faces, little girls?! ",,,
5553,Cameron ," No, no, it's all right, everybody!",,,
5554,Gloria ," Huh?! Cameron, wait in the car! Cameron!",,,
5555,Cameron ," Gloria, I think it's drivable! Gloria!",,,
5556,Phil ," Just so you know, I'm going back up to Luke's room, And I'm not leaving until he's finished.",,,
5557,Claire , Thank you.,,,
5558,Phil , And I'm really sorry for not underestimating Luke enough.,,,
5559,Claire ," Well, that means a lot to me.",,,
5560,Phil , The hardest part is he kind of takes after me with all this. Hmm. Like my lack of focus and your...,,,
5561,Claire , My what?,,,
5562,Phil , I just love you.,,,
5563,Claire , Hmm?,,,
5564,Luke , I did it.,,,
5565,Phil , Buddy!,,,
5566,Claire ," Oh, my god.",,,
5567,Luke , Do you like it?,,,
5568,Claire , I-I-I love it. Did you do this?,,,
5569,Phil , All him.,,,
5570,Luke ," I used Mr. Potato head ears Because Van Gogh cut his ear off. And there's money, because his paintings sell for, like, a bajillion dollars, Which is sad, because he died broke.",,,
5571,Claire , Yes. That... you were right.,,,
5572,Phil , Don't apologize.,,,
5573,Claire , I'm not apologizing.,,,
5574,Phil , Apology accepted.,,,
5575,Claire ," Luke, I-I really couldn't be more proud of you, And I am so sorry I didn't give you more credit.",,,
5576,Luke , Thanks.,,,
5577,Phil ," Way to go, buddy.",,,
5578,Claire , I got to go finish the cupcakes.,,,
5579,Haley , No. She didn't.,,,
5580,Claire ," Sweetie, can you hand me those?",,,
5581,Haley ," Uh-huh. Yeah, I can talk. What are you doing?! ",,,
5582,Claire ," Well, I showed you how to make them, And now you can do it yourself. Come on, guys, let's go.",,,
5583,Haley ," Well, good, because I really wanted to. Okay. Setting the oven to 700! I'm putting the eggs in the bowl! Oh, I got some shells in them! Uh-oh! Are you serious?!",,,
5584,Mitchell , Hey.,,,
5585,Manny ," Hey, Mitchell.",,,
5586,Mitchell ," So, I know you'd never, um... I know you'd never never believe this By looking at me right now, But, uh, I used to get picked on at school, too.",,,
5587,Manny ," So, Jay told you?",,,
5588,Mitchell ," Yeah. Yeah, they would, um… they'd call me weird. I was weird… fun weird. But I… this is the funny thing about growing up. For years and years, everybody's desperately afraid to be different, you know, in any way. And then, suddenly, almost overnight. Everybody wants to be different. And that is where we win.",,,
5589,Manny , I'm sort of counting on that. I'm sorry I was picking on you too much.,,,
5590,Mitchell ," No, it's...",,,
5591,Manny , Jay said that's what brothers do.,,,
5592,Mitchell ," well, we don't have to listen to him. Brothers do that, too.",,,
5593,Jay ," Okay, ladies, finish up your tea party. You're missing the show.",,,
5594,Mitchell ," I can't believe I was fighting over this guy, huh?",,,
5595,Jay ," Check it out. Oh, whoa. Check it out.",,,
5596,Mitchell , Wow.,,,
5597,Manny , Awesome. ,,,
5598,Alex , Mom? You better get down here!,,,
5599,Claire , Mmm!,,,
5600,Phil ," Oh, my god!",,,
5601,Claire , Whoa! Delicious.,,,
5602,Haley, Uh-huh.,,,
5603,Claire , I am so proud.,,,
5604,Haley ," Oh, thanks, mom. I'm just gonna wrap these up.",,,
5605,Claire ," Oh, you know what, sweetie? You're gonna be late for school. Just go. I'll bring them by later.",,,
5606,Haley , Are you sure? I'm done?,,,
5607,Claire ," Yeah,",,,
5608,Phil ," Get out of here, Betty Crocker.",,,
5609,Haley , Okay.,,,
5610,Claire , So proud of you!,,,
5611,Phil , Ugh!,,,
5612,Claire , Do we still have the number for poison control?,,,
5613,Phil ," I love you, Claire! I've always loved you!",,,
5614,Luke , My mouth is asleep like at the dentist.,,,
5615,Phil ," Get over here, buddy. ",,,
5616,Luke ," Why did he paint ""starry night""? Maybe 'cause the sky is beautiful And everybody likes looking at it. And it reminds us that something's up there, watching over all of us, aliens, who could be here in a second to liquefy us and use us as fuel. So, wake up, people. We're next.  Modern Family",,,
5617,Luke ," Today, Sam Riley kicked a soccer ball, and it hit another kid so hard, his eye popped out.",,,
5618,Phil , Awesome.,,,
5619,Claire , Really? His eye popped out?,,,
5620,Phil ," Well, got to hit the sack. Big Saturday tomorrow.",,,
5621,Claire , That's right. It's somebody's birthday.,,,
5622,Phil ," Not just that. The iPad comes out on my actual birthday. It's like Steve Jobs and God got together to say, ""We love you, Phil.""",,,
5623,Claire , What's so great about that doohickey anyhow?,,,
5624,Phil ," ""Doohickey,"" Elly May? It's a movie theater, a library, and a music store all rolled into one awesome pad.",,,
5625,Alex , A library is a place where people get books.,,,
5626,Haley , A movie theater is a place where people go on dates.,,,
5627,Phil ," I'll load the beach chair into the trunk, for the line in the morning.",,,
5628,Claire ," Wait, honey, hang on. You can't spend your birthday in line.",,,
5629,Phil ,,"00, or forget about",,
5630,"it, and then I'm out by 10",00.,,,
5631,Claire , Why don't you let me do it?,,,
5632,Phil ," Claire, you don't have to do that.",,,
5633,Claire ," No, I know, but I want to. That way, on your birthday, you'll wake up, and you'll have your brand-new... toy.",,,
5634,Phil ," In spite of you calling it a toy, this is shaping up to to the best birthday I ever had.",,,
5635,Haley , Thank God we didn't have to hear that stupid story about...,,,
5636,Phil ," It was called the fun zone. I was 11. I hit 10 straight fastballs in the batting cage. Then my best friend, Jeff Sweeney, stepped in and took one in the groin. I yelled out, ""Ball two!"" Everybody laughed. That was when I knew I was funny. Good night. ",,,
5637,Gloria , Are you sure there's not an e-i in the middle?,,,
5638,Manny , No. It's i-e.,,,
5639,Gloria ," Good, papi. If I can't fool you, then your teachers can't fool you, either.",,,
5640,Manny , I don't think they're trying to fool me.,,,
5641,Jay , Wait until you see what I got Phil for his birthday. I found it on the Skymall catalog.,,,
5642,Gloria ,,05. It's,,
5643,6,"25. Wake up. Wake up.""",,,
5644,Jay ," Even better... A rosewood chess set. Before I wrap this thing, what say we take it for a spin? Manny, I'll teach you.",,,
5645,Gloria , He knows how to play. His father taught him how to play.,,,
5646,Jay ," I'm gonna teach him real chess, not the Colombian version. We actually use the pieces to play the game, not smuggle stuff out of the country.",,,
5647,Gloria , I know one Colombian piece you won't be playing with later.,,,
5648,Jay ," Manny, come on! let's see what you got.",,,
5649,Gloria , You'd be surprised. Let him win!,,,
5650,Gloria ," Manny's an excellent player. But Jay is a grumpy loser. He mopes, he makes the face, he slams the door, then he said he didn't slam the door. It's better that he wins.",,,
5651,Mitchell , I got this.,,,
5652,Voice , Everything's gonna be okay. It's okay. It's okay.,,,
5653,Cameron , Leave me alone.,,,
5654,Mitchell , There's a man in Lily's room. There's a man in Lily's room!,,,
5655,Cameron ," It's go time. Oh, thank God.",,,
5656,Mitchell ," It's me, it's me, it's me.",,,
5657,Cameron , She's fine. We must have just heard a neighbor with the same monitor.,,,
5658,Mitchell ," Thank God. Boy, if a spider would've broken in here, he would've been in trou-ble. ",,,
5659,Manny , B-e-l-i-e-v-e. Believe.  [OPENING CREDITS],,,
5660,Claire , Light-up barbecue tongs. This was the lame gift I got Phil.,,,
5661,So... Was I bummed to get up at 5,"00 in the morning and wait in line? No, because I was finally getting my husband something that he really, really wanted. I was every bit as excited as he was.",,,
5662,Jay ," Hey, buddy. I hope you're not upset about our chess match yesterday. What do you say we play again?",,,
5663,Manny , I'm good.,,,
5664,Jay , That's the spirit. Downloaded this for you. It's kind of a kid's guide to chess.,,,
5665,Manny ," No, Jay. I'm good.",,,
5666,Jay ," It's not all dry like that. They have fun with it. See, you can color in the little players with your crayons.",,,
5667,Manny , You are making me want to play again.,,,
5668,Jay ," We're lighting a fire. Let me toss this out. If you beat me, if that day should ever come, I'll give you, uh...",,,
5669,Manny , I want your watch.,,,
5670,Jay ," Wow. You had that loaded up, huh? Okay. Game on. Now, I want you to go first. Now, remember, try to open up the middle of the board. I'd have moved that guy two spaces. More aggressive. And you don't want to bring your queen out that quickly. You could have protected that with that, but now you're vulnerable to...",,,
5671,Manny , Checkmate.,,,
5672,Jay , What? How'd you do that?,,,
5673,Cameron , You will not believe what's going on at Jake and Debbie's house.,,,
5674,Mitchell , Who?,,,
5675,Cameron ," The people on the monitor. So much drama. Okay. Jake told Debbie that he had to work late, so she called his boss and found out that he didn't. Busted! So she spent all morning on the phone crying and crying to her mother and said if Jake has to work ""late"" one more time, she's filing for divorce. ",,,
5676,Mitchell , Huh.,,,
5677,Cameron ," That's it? I give you that tasty dish, and all you give me is a ""huh""?",,,
5678,Mitchell ," I'm s... Cam, I froze last night. I froze. I thought Lily was in danger, and I froze. But not you. You sprung right into action. You even had the cool ""It's go time"" line.",,,
5679,Cameron , That comes to me naturally. I spent a year as a crossing guard.,,,
5680,Mitchell ," What kind of parent am I if I can't even protect my own family? Just once I would love to be the guy with no fear who can stand up and... I don't know, you know, kick some ass.",,,
5681,Cameron , You're so cute when you're angry with your little fists. I just want to put you in my pocket.,,,
5682,Alex , I think he's coming.,,,
5683,Haley , Here he comes. Dad!,,,
5684,Kids , Happy birthday!,,,
5685,Phil ," You guys, that's awesome. Who are these from?",,,
5686,Alex , Cam and Mitchell.,,,
5687,Phil , Those guys are a class act.,,,
5688,Haley , We're making you breakfast. French waffle cakes.,,,
5689,Phil ," Let me guess. One waffle in between two pieces of French toast, wrapped in a pancake.",,,
5690,Haley , Nailed it.,,,
5691,Phil ," Bring it in here, monkeys. Love you! Get over here! Good enough.",,,
5692,Luke , Where's mom?,,,
5693,Phil ," You mean the greatest woman in the world? She is standing in line at the Apple store, making all my birthday wishes come true. Let's see how these bad boys taste. That is hot!",,,
5694,Luke , Are you okay?,,,
5695,Phil ," Fresh out of the oven, eh? That is...",,,
5696,Haley , Do you want some ice?,,,
5697,Phil ," Yes. Oh, man, this... Oh, that feels better. That feels better. No, it actually... feels weird. That burns in a different way! Don't wash this until we see if I can get my skin back, okay? ",,,
5698,Phil , Let me see it!,,,
5699,Claire , No! Your party's not until tonight. You'll have to wait.,,,
5700,Phil ," Just let me see the bag. Did you leave it in the car? Who'd you deal with? Was it a guy named Mehar? They call him ""the beast."" Tiny guy. He must move a ton of product. I kind of love that you're making me wait. You are the best wife ever! You are the best wife ever!",,,
5701,Claire ," I didn't get you the iPad. I got to the store, they were all out. I'm so sorry.",,,
5702,Phil , I don't understand. My online buddies got it. Sat800 and,,,
5703,Brobot didn't get there until 8,"00, and you definitely got there",,,
5704,"before 'em, because you got there at 6",30. You didn't get there at,,,
5705,6,30? Where were you?,,,
5706,Claire ,,00. Got up. Came downstairs. I fell asleep.,,
5707,Phil ," Oh, my goodness. What have I done? What have I done? I should've done this myself.",,,
5708,Claire , They're gonna get more in next week.,,,
5709,Phil ," Next week? That's, like, the worst thing you can say to an early adopter.",,,
5710,Claire , Where are you going?,,,
5711,Phil , To a place where birthdays still mean something.,,,
5712,Manny , I'll get that.,,,
5713,Mitchell , Hey Manny.,,,
5714,Manny ,,17 on a Saturday afternoon?,,
5715,Mitchell ," I'm just returning my dad's belt of tools, so...",,,
5716,Manny ,,17 on a Saturday afternoon?,,
5717,Jay ," Don't you have something better to do? So, were you a big hit?",,,
5718,Mitchell , What do you mean?,,,
5719,Jay ," Well, I just assumed it was some kind of costume party. Was Cam the Indian? ",,,
5720,Mitchell ," For your information, dad, we were doing a little construction at the house.",,,
5721,Jay , What did you build?,,,
5722,Mitchell , A gift-wrapping station.,,,
5723,Jay , And we're back.,,,
5724,Mitchell , So...,,,
5725,Jay , Thank you for that.,,,
5726,Mitchell ," You're welcome. Hey, uh, dad, do you remember when I was probably 11 and you were teaching me how to fight, and then I quit?",,,
5727,Jay ," You said everything you needed to learn, you'd learned from ""West Side Story."" How'd that work out for you?",,,
5728,Mitchell ," If I'm ever in a dance fight, I'll let you know. Is the offer, uh, still good?",,,
5729,Jay , What's the matter? You got problems with Cam?,,,
5730,Mitchell , No! Why would you say that?,,,
5731,Jay ," Come on. I mean, you know, sharing a room with a guy? I bunked with my brother. I know that can get pretty rough.",,,
5732,Mitchell ," I don't ""bunk"" with Cam. Dad, I just want to learn a little self-defense.",,,
5733,Jay , Show me what you remember.,,,
5734,Mitchell ," Right... right now? Gosh, uh... Thumbs out.",,,
5735,Jay , Thumbs... attaboy.,,,
5736,Mitchell ," That wasn't very pretty, was it?",,,
5737,Jay , You know what? Maybe it was a little too pretty. That's the thing.,,,
5738,Luke , Here it goes.,,,
5739,Alex ," Oh! Buddy, I think the problem is you're not jumping from high enough. You should get on top of the garage.",,,
5740,Claire ," Alex, stop trying to kill Luke. I need your help. We've got to find your dad one of those iPad thingies. So, Haley, text everyone you know. Alex, Facebook, chat, tweet, buzz, bling... Just do what you have to do. We have got to find one of these iPads, okay? Luke, that means stay out of everyone's way and stop inhaling the balloons. ",,,
5741,Luke , I'm not inhaling them.,,,
5742,Claire , Stop lying.,,,
5743,Luke , How did she know?,,,
5744,Phil ," Didn't your mama teach you never to take a ride from a stranger?! Got a little vacation time coming up? Have fun on the Moon! Not feeling too well lately? Maybe you should come see the doctor, and I'll... get rid of it!",,,
5745,Boy , What's that supposed to mean?,,,
5746,Voice ," Attention. If you're here for Phil's birthday party, they're gathering in the picnic area. Phil's birthday party.",,,
5747,Phil , My wife knew I'd be here. She put together a whole party for me.,,,
5748,Boy , Does that really make up for not getting an iPad?,,,
5749,Phil ," Don't make me sorry I shared that with you, okay? See you, fellas. Howdy do! I just heard the announcement for Phil's birthday party.",,,
5750,Girl , Phil? Yeah! It's right around the corner.,,,
5751,Phil , Awesome.,,,
5752,Girl , Have fun.,,,
5753,Phil ," Thank you. Thanks, milady.",,,
5754,Everybody ," Happy birthday, Phil!",,,
5755,Littl' Phil , This is awesome!,,,
5756,Jake ," Hello? No, I'm just putting the baby down.",,,
5757,Cameron , That's Jake. He's the one having an affair.,,,
5758,Jake ," I know. Yeah, I can do it tomorrow night. I'll just give my wife some excuse.",,,
5759,Cameron , Men are pigs.,,,
5760,Jake ," I don't really have a choice, do I? Yeah, you could not cheat on her. How about that?! Because it has to be a surprise. When she hears me speaking Italian to her grandmother, it'll be worth all this sneaking around.",,,
5761,Cameron ," Lily, I had it backwards. He's wonderful.",,,
5762,Jake , I'll just tell her I'm working late. ,,,
5763,Cameron ," No, Jake, don't do that! That's the worst thing you could do!",,,
5764,Jake , Buona notte.,,,
5765,Cameron ," Oh, no, what are we gonna do? We have to fix this.",,,
5766,Jay ," I'm gonna teach you a couple of basic Brazilian jujitsu moves. Now, just... Just attack me.",,,
5767,Mitchell , I'm sorry. What?,,,
5768,Jay ," Take any deep-seated anger you have, get a running start and come.",,,
5769,Mitchell , I don't have any deep-seated anger.,,,
5770,Jay ," Remember that Halloween when I wouldn't let you go as Olivia Newton-John? You see what I did? I used your momentum against you. Learned this from the Gracie brothers. It's called the lion killer, mata-leao. Try to get out. Try to get out. There, you see?",,,
5771,Mitchell , I can't.,,,
