,Name,LineA,LineB,LineC,Concatenated
1784,Alex , Did you know that fencing goes back to the 12th century?,,,
1785,Haley , You know what's even nerdier than fencing? Knowing when it began.,,,
1786,Luke ," I don't think you're a nerd, Alex.",,,
1787,Alex ," Shut up, dork.",,,
1788,Jay , All right! That's my boy!,,,
1789,Mitchell , Would this be easier if we suspended you from a crane?,,,
1790,Cameron , Any monkey can shoot a home movie. I pride myself on shooting home films.,,,
1791,Mitchell ," Yeah, but, Cameron, you always just take things a little too far.",,,
1792,Cameron ," No, I don't.",,,
1793,Mitchell ," Okay, your nephew's first birthday.",,,
1794,Cameron , That's not fair.,,,
1795,Mitchell , You brought a wind machine.,,,
1796,Cameron ," To be fair, my vision was...",,,
1797,Mitchell ," Cameron, you brought a wind machine.",,,
1798,Cameron , Who puts wheels on cribs? ,,,
1799,Gloria ," Mi tigre! Mi tigre! Yes! Ay, sorry. Sorry.",,,
1800,Phil , That's okay.,,,
1801,Haley ," No! No, no, no, no, no! My phone died!",,,
1802,Alex , No biggie. Your battery probably just statically defracticated.,,,
1803,Haley , What?,,,
1804,Alex , It means you can recharge it with static electricity. Just rub it on your hair.,,,
1805,Jay ," Yes! You know, I used to go to the houses of my friends, And it used to bug me, their kids you know?, Because there was never a trophy in my house. Not until this one.",,,
1806,Phil , That's a good grip ! Can we switch seats?,,,
1807,Mitchell ," Cam, people are staring.",,,
1808,Jay ," I know you're not supposed to care, but it's kind of cool to have a kid in your house who's the best at something, you know what I mean?",,,
1809,Phil , Mm-hmm.,,,
1810,Phil ," Yeah, our kids are great.",,,
1811,Claire , They're the greatest.,,,
1812,Phil ," Gosh, we're blessed.",,,
1813,Claire ," We are. But, um... Are they the best at something? I'd have to think about that.",,,
1814,Phil ," Well, Alex is great at every single thing she tries, So, you know, she'll find her specialty.",,,
1815,Claire , She will. And... and Haley is...,,,
1816,Phil , Haley is so pretty.,,,
1817,Claire , Gorgeous.,,,
1818,Phil ," Oh, gosh. Gorgeous girl. I mean... So, she can meet someone who's the best at something.",,,
1819,Claire , That's right.,,,
1820,Phil ," And then, I guess that leaves Luke. We dropped the ball a little bit on that one.",,,
1821,Claire ," Yeah, a little bit.  [OPENING CREDITS] ",,,
1822,Presenter , How about a nice round of applause for our winner; Manny Delgado.,,,
1823,Everyone ," Bravo, bravo!",,,
1824,Presenter ," Manny now moves on to the championship, where he'll be competing against Caroline Markum. We'll see you all",,,
1825,back here at 4,30.,,,
1826,Jay , All right! What she said.,,,
1827,Claire , Wow. This means more to dad than it does to Manny.,,,
1828,Mitchell ," Yeah, it's his chance to be, you know, father of a champion. Well, second chance. But we all know how the first time went.",,,
1829,Claire , Did I say something wrong?,,,
1830,Mitchell ," No. No. I'm... I'm very happy for Manny, that's all. Everything's not always about Claire. Geez.",,,
1831,Jay , I want to thank you guys for coming by and supporting the kid. You guys are the best.,,,
1832,Phil ," Why, Claire?!",,,
1833,Claire ," Come on, sweetie.",,,
1834,Mitchell ," Really? Well, that took a while.",,,
1835,Cameron ," Well, she's been asleep for 20 minutes. It just took me some time to sneak out without waking her up.",,,
1836,Mitchell , Kind of like the first time you slept over here.,,,
1837,Cameron ," I had a meeting. All right, let's talk about why you got your panties in a bunch. What's up with you and your sister?",,,
1838,Mitchell , Nothing is up.,,,
1839,Cameron , Mm-hmm. Or could this have something to do with... Ice skating?,,,
1840,Cameron , When Mitchell and Claire were kids...,,,
1841,Mitchell , This is interesting to no one. ,,,
1842,Cameron ," Excuse... please let me finish. Thank you. When Mitchell was 10... 11... and Claire was 13, they were competitive ice dancers.",,,
1843,Mitchell ," Figure skaters. Oh, for god's sakes, I'll tell the story. Yes, my sister and I were actually a very good team. We were called ""fire and nice."" I was ""fire,"" 'cause of the red hair, and Claire was ""nice"", because it was ironic and she wasn't.",,,
1844,Cameron , And Mitchell is still upset because Claire quit the team right before some meet.,,,
1845,Mitchell , some meet? The 13-and-under regional championships. Just the emerald city at the end of my yellow brick road.,,,
1846,Cameron , Wow. You did it.,,,
1847,Mitchell , What?,,,
1848,Cameron , You made figure skating sound even gayer.,,,
1849,Cameron ," So, seeing your dad so proud of Manny didn't stir up any resentment?",,,
1850,Mitchell , Mnh-mnh.,,,
1851,Cameron ," Okay. Okay, fine, you always do this. Instead of letting your feelings out, you bury them, and then they bubble up later in hurtful ways.",,,
1852,Mitchell ," Okay, you know what, you... Yes, all right. Listen, I might still be holding a little resentment, but that's... Embarrassing and petty, And it's not a good color on me. It's kind of like you and yellow.",,,
1853,Cameron , You love me in my yellow shirt.,,,
1854,Mitchell , It makes you look like the sun.,,,
1855,Cameron , Okay. Bubbling. Hurtful bubbling. Now you know why I left early that morning.,,,
1856,Mitchell ," Ha! I knew you didn't have a meeting, Cam! I knew it!",,,
1857,Haley ," There must be something wrong with this phone. I've rubbed it on my head for, like, an hour.",,,
1858,Claire , What? Alex.,,,
1859,Haley ," Oh, you're such a geek!",,,
1860,Alex , At least I didn't give myself a bald spot. ,,,
1861,Haley ," Oh, my god! Mom!",,,
1862,Claire ," Alex, don't be mean. Haley, stop making yourself such an easy target.",,,
1863,Phil ," This feels right, buddy. I'm telling you, this feels right.",,,
1864,Claire , What are you guys doing?,,,
1865,Phil ," Pursuing excellence. We made a list of areas the boy might excel at, and... baseball!",,,
1866,Claire , Love it.,,,
1867,Phil ," Yeah. I read it only takes 10,000 hours to achieve excellence. You've already got, like, what, how many hours playing ball?",,,
1868,Luke ," Well, I played, like, one season. So, like, 6,000 hours?",,,
1869,Claire ," Yeah, I can see why you ruled out math.",,,
1870,Claire," Yeah, of course I want Luke to be successful, but I don't think that a parent can just force that. I think you just have to have faith that the kid's gonna find his own way. Besides, Luke already is the best at something... Being my son. It sounded a lot less lame in my head.",,,
1871,Phil , I have got a good feeling about this. This is gonna be your sport.,,,
1872,Luke ," Last year, you said basketball was my sport.",,,
1873,Phil ," Look, I've said a lot of things I wish I could take back, But I can't. What I can do is be the dad you need me to be to help you become masterful. You want to be masterful?",,,
1874,Luke , I guess.,,,
1875,Phil ," There's my killer! Okay. Our journey of 10,000 hours begins with a single pitch. I believe in my boy! I ain't gonna quit you. Let's burn one in here. That's good. That's a good start. Okay, you... Rest that cannon while I run this down, okay? Okay. Let's keep all the batters right here. Oh! Should have... should have worn my cup. Should have worn my cup. Home run! This one's really in here, buddy. Okay. Very, very, very, very good first hour. Toss me your glove. I'll put some oil...On it. Yeah.",,,
1876,Jay , Everything okay? ,,,
1877,Gloria ," Yes, I was telling my grandmother how great was Manny today.",,,
1878,Jay ," So, that wasn't angry talk?",,,
1879,Gloria ," No, silly, that was happy talk.",,,
1880,Jay ," Ah, I'm beginning to understand Why there's so much conflict on your continent. Here, check this out.",,,
1881,Gloria ," Aw, Jay. Jay loves to make t-shirts for special occasions. Come on, baby, show them.",,,
1882,Jay ," A few years back, my granddaughter Haley ran a 5k, So I had a few of these made up. It's just fun.",,,
1883,Gloria , I love it when you're so proud of Manny.,,,
1884,Jay ," You know, I'm not gonna lie. Seeing him out there slicing those kids to pieces, you know, it... it gets to you.",,,
1885,Gloria ," Oye, gracias, mi amor.",,,
1886,Manny , I'm sorry to interrupt.,,,
1887,Gloria ," It's okay, papi.",,,
1888,Jay ," Hey, champ. I got a little something for you.",,,
1889,Manny ," And I have something for you. Here, I will not be needing it anymore.",,,
1890,Jay , But the finals.,,,
1891,Manny , I am retired. ,,,
1892,Jay ," Wait! Wait, wait! You can't retire.",,,
1893,Manny , It's just not fun anymore.,,,
1894,Jay ," Well, it's probably just butterflies. Come on, you're gonna be fine.",,,
1895,Gloria ," Look, if he doesn't want to, it's his decision.",,,
1896,Jay ," Oh, the hell it is.",,,
1897,Gloria ," He shouldn't be doing anything that makes him nervous. Papi, I support you.",,,
1898,Manny , I'm not nervous. I just don't want to fight a girl.,,,
1899,Gloria , What?,,,
1900,Manny , Defeating a woman would be a mark on my honor.,,,
1901,Gloria , Why? Because men are always so superior to a woman?,,,
1902,Manny , Uh... ,,,
1903,Gloria ," Uh, uh! So superior that you cannot even finish your sentence?",,,
1904,Jay , Dude.,,,
1905,Gloria ," Manny, you always call yourself the lover of women. But if you don't compete with this girl, you're showing me and all the women that you don't respect us.",,,
1906,Manny , I'm sorry.,,,
1907,Gloria , Okay. So take back your sword and go fight this girl like a bull!,,,
1908,Manny , Okay.,,,
1909,Gloria , Can't hear you!,,,
1910,Manny , Okay!,,,
1911,Jay , I can't hear you!,,,
1912,Manny , That's really as loud as I can go.,,,
1913,Phil ," What does it take to make a great salesman? It's no big secret. You just follow the abc's of salesmanship... always be closing. Don't ever forget great home ideas just keep lurking mostly nearby. Often, people question realtors' sincerity. Take umbrage. Violators will... Oh, shoot, ""x,"" ""x,"" ""x""...",,,
1914,Phil ," And this is the great room, Although ""great"" hardly seems to do a room like this justice. Weird squiggly painting not included.",,,
1915,Woman , I actually love it.,,,
1916,Phil ," I do, too. It's really beautiful. Um, all... all custom built-ins. And you'll notice just... just tons of natural light, So that's great.",,,
1917,Phil ," Did I need the sale? Yes. Was I worried? No. Why? Because. Because why? Because I won't sell anything I don't believe in. And when I believe, you believe. I can sell a fur coat to an Eskimo.",,,
1918,Woman ," Yeah, Phil, I'm sorry. It's a beautiful house. But I'm just not sure how kid-friendly it is, and we have two small children. I mean, these stairs alone...",,,
1919,Luke ," Dad, this place is awesome.",,,
1920,Phil ," Not now, Luke. ",,,
1921,Luke ," Did you see the backyard? It's got room for, like, 10 tree houses. And the bedroom's got a window on the ceiling. I wish we could live here.",,,
1922,Phil ," I wish you'd go back out to the patio, where...",,,
1923,Woman , Do you really?,,,
1924,Luke ," Oh, yeah. Our house sucks compared to this one.",,,
1925,Phil , It really does.,,,
1926,Claire ," There you are. I'm gonna get changed, and then we're off to manny's match, okay?",,,
1927,Luke , Dad doesn't want me to go.,,,
1928,Claire , What? Why?,,,
1929,Phil , Remember when you were all worried that our son's a dud?,,,
1930,Claire ," Okay, that's not exactly the way I remember it.",,,
1931,Phil , Turns out he's a natural.,,,
1932,Claire , At what?,,,
1933,Phil , At selling.,,,
1934,Phil ," Hey, titans of residential real estate. That's right, I'm talking to you, Sandy Brewster, Skip Woosnum, J.J. Mccubbin. Hear those footsteps? That's Luke Dunphy, And he's gonna drink your milkshake.",,,
1935,Claire , That's amazing.,,,
1936,Phil , Right?!,,,
1937,Claire , Incredible.,,,
1938,Phil ," So, the owner's coming back in an hour with her husband, And I need him. I am telling you, that kid is a genius. There's the rainmaker!",,,
1939,Claire , Why is your ipod in your mouth?,,,
1940,Luke , I'm charging it.,,,
1941,Claire , Alex. Alex!,,,
1942,Cameron ," So, there's no part of you that wants to clear the air with your sister?",,,
1943,Mitchell , Nope. ,,,
1944,Cameron ," Okay, fine. That's your family's way. I'll respect that. But you should know it's hard on the people who love you.",,,
1945,Mitchell ," Cam, stop being so dramatic.",,,
1946,Cameron , We feel the tension. We hear the words that cut like knives.,,,
1947,Claire ," Hey, guys! I brought orange slices.",,,
1948,Cameron ," Okay, you know what? I can't bear this. Claire, Mitchell still resents you for quitting the figure-skating team when you were kids. Ladies, come inside with me, please. Work it out. Come on.",,,
1949,Mitchell ," Thanks, cam.",,,
1950,Claire , Is he serious? Is that what your little jab was about this morning?,,,
1951,Mitchell ," Okay, no... yes. Okay, yes. Yes, I'm... I guess I'm still a little angry. But, you know, you stole my moment, Claire.",,,
1952,Claire ," Yeah, 21 years ago.",,,
1953,Mitchell ," Okay, no, but it doesn't matter to you because you had your own moments. You had cheerleading and high-school plays and, uh, making out with the quarterback and...",,,
1954,Claire ," Oh, come on. You made out with him, too.",,,
1955,Mitchell ," Yeah, but we had to keep it a secret. You shouldn't have quit. It was selfish.",,,
1956,Claire , You want to know why I quit? I quit to protect you.,,,
1957,Mitchell , From what? Glory? Fame?,,,
1958,Claire ," No, come on.",,,
1959,Mitchell , Press conferences?,,,
1960,Claire ," I was bigger than you. I was bigger than you, and I was afraid you wouldn't be able to lift me. You were... you were dropping me in practice, and I didn't want you to humiliate yourself...",,,
1961,Mitchell , I dropped you twice.,,,
1962,Claire , In front of all of those people.,,,
1963,Mitchell , Three times.,,,
1964,Claire , You dropped me all the time. Come on. Can't you just forgive me and move on? ,,,
1965,Mitchell ," Of cour... yes, yes. Yes, of cour... I'm sorry. I'm sorry. Ugh. God, this must seem so petty to you, huh?",,,
1966,Claire ," Well, it's a little silly, But we all have our thing, don't we? I'm just glad you're getting it... Out of you. Are you trying to lift me?! Let me. You are! You're trying to lift me!",,,
1967,Jay ," Stay focused, stay loose, and stay angry. Who's the toughest?",,,
1968,Manny , I am!,,,
1969,Gloria , Who's the bravest?!,,,
1970,Manny , I am.,,,
1971,Jay , Who's the baddest?,,,
1972,Manny , Can you guys ask all the questions now so I don't have to keep lifting this?,,,
1973,Jay , Go. Go get 'em!,,,
1974,Woman , Are you all set?,,,
1975,Caroline , Yeah.,,,
1976,Woman ," Okay, go get 'em! Good luck! Excuse me... is this seat taken?",,,
1977,Gloria ," No, sit.",,,
1978,Woman ," Oh, thank you. Oh, is Manny yours?",,,
1979,Gloria , Yes.,,,
1980,Woman ," Oh, he's quite good. I saw him earlier.",,,
1981,Gloria ," Ay, thank you.",,,
1982,Woman , Yeah.,,,
1983,Gloria , Is she your little girl?,,,
1984,Woman ," Oh, Caroline? No. No. Sadly, her parents passed away. I'm her nurse down at the children's hospital. But all of my patients are like family to me.",,,
1985,Gloria , Oh.,,,
1986,Man ," Well, our boys are enjoying themselves.",,,
1987,Phil ," Yeah. I can talk about crown moldings and recessed lighting till the cows come home, but nothing compares with that sound right there.",,,
1988,Luke , Ow!,,,
1989,Phil , Oh. ,,,
1990,Luke , Ow!,,,
1991,Phil ," Hey, buddy. Oh, he's fine.",,,
1992,Luke , My foot! I think it's backwards!,,,
1993,Phil , It's not backwards.,,,
1994,Man , What happened?,,,
1995,Luke , It's the stupid floors. They're too slippery.,,,
1996,Phil , Oak. Also known as nature's pillow.,,,
1997,Luke , It's like ice.,,,
1998,Phil ," Now, let's not start blaming the floors. You shouldn't have been running.",,,
1999,Luke , I saw a ghost.,,,
2000,Phil , G-ghost? Hey... Phil Dunphy. O-kay. That's me. That's acting like a natural shoehorn. Okay. Probably better all take our shoes off for this part of the tour. Follow me.,,,
2001,Woman , She's our little miracle.,,,
2002,Gloria , Oh.,,,
2003,Woman ," I only wish her father had made it back from Afghanistan to see this. Oh! There's our cheering section! Over here, you guys!",,,
2004,Gloria ," Oh, my god, we have to stop him.",,,
2005,Jay , Maybe I can pull the fire alarm.,,,
2006,Manny , Expect no mercy.,,,
2007,Caroline ," Bring it on, big boy.",,,
2008,Mitchell ," I-I'm glad dad's proud of Manny. I am. I just... It would have been nice to see him that proud of us. And by ""us,"" I mean ""me.""",,,
2009,Claire ," And you sincerely thought that the path to dad's approval Was going to be through figure skating? Mitchell, I am fairly confident that dad's proudest moment was when you finally took off the flame-red unitard.",,,
2010,Mitchell ," I am not claiming that any of this is rational. I'm... I'm sorry. I'm sorry for being such a pill, okay?",,,
2011,Claire ," I... Actually always felt very guilty for quitting. Look, I know how much you loved figure skating. ",,,
2012,Mitchell , I...Never really loved skating.,,,
2013,Claire ," Uh, what?",,,
2014,Mitchell ," um, all right. This is gonna sound a little gay. But, um, when... when you and I skated together, You know, you weren't the mean older sister and I wasn't the... the clingy little brother. We were... we were a team. And, well, let's face it, We've kind of grown apart in the past few years, And... and with mom and dad's divorce, we were on opposing sides, and I just...I... I just... I miss being on your team.",,,
2015,Claire , That's...,,,
2016,Mitchell , ...A little gay.,,,
2017,Claire ," Okay, There we go.",,,
2018,Mitchell ," Claire, where are you going? Claire? No way!",,,
2019,Claire , Get up.,,,
2020,Mitchell , Really?,,,
2021,Claire , Mm-hmm. Don't drop me.,,,
2022,Everyone , Oh! Oh! Oh!,,,
2023,Jay , Put it away or lose it.,,,
2024,Everyone , Oh!,,,
2025,Jay , Somebody's got to put a stop to this.,,,
2026,Claire ," That's it, Mitchell.",,,
2027,Gloria ," So, can we take you and Caroline out for ice cream?",,,
2028,Woman , We can't. She's diabetic.,,,
2029,Jay , Of course she is.,,,
2030,Jay , Let's get out of here. Let's get this thing in the trunk. I can't decide if I'm feeling more proud or mortified.,,,
2031,Gloria , How about now?,,,
2032,Jay," We tell our kids it doesn't matter if you win or lose, but let's be honest, winning feels pretty great. There's nothing like that golden moment in the sun. I think every parent probably wants that for their child. You know, maybe a little bit for ourselves, too. ",,,
2033,Phil , Buddy!,,,
2034,Jay ," So, sometimes, we push too hard. And that leads to a lot of resentment and guilt. So, how much is too much? Here's where I come out. Guilt fades. Hardware is forever.",,,
2035,Mitchell ," You're mad, aren't you?",,,
2036,Cameron , I'm not mad.,,,
2037,Mitchell ," Yes, you are.",,,
2038,Cameron ," No, I am not.",,,
2039,Mitchell , You're a little jealous.,,,
2040,Cameron , I'm...happy for the two of you.,,,
2041,Mitchell ," All right, come on. We'll do one. Stay there.",,,
2042,Cameron , For real?,,,
2043,Mitchell , Yep. Feel better?,,,
2044,Cameron ," Yeah. Oh, do me now. Come on.",,,
2045,Mitchell ," What are you talking about? Are you serious? Cam, no! Ow!   Modern Family",,,
2046,Phil , Fix that step. Morning.,,,
2047,Claire , I'm still sleeping.,,,
2048,Phil , Happy anniversary.,,,
2049,Claire , And they said we wouldn't last.,,,
2050,Phil , Who said that?,,,
2051,Claire ," Oh, look at you. You're cute.",,,
2052,Phil , Go ahead. Open it.,,,
2053,Claire , What have you done?,,,
2054,Phil ," Nothing. Something, nothing.",,,
2055,Claire , It's a View-Master.,,,
2056,Phil , Look inside.,,,
2057,Claire ," Oh, it's us. Look at how young we are. Oh, God, that perm.",,,
2058,Phil ," Yeah, it really framed my face.",,,
2059,Claire , Why is there a picture of a bracelet?,,,
2060,Phil , Must be some kind of a mistake.,,,
2061,Claire ," What the heck is that? Oh, Phil, you didn't.",,,
2062,Phil , What? Did he? Did he?,,,
2063,Claire ," It's beautiful. Oh, sweetie, I love it. Okay, your turn.",,,
2064,Phil , My turn? Where is it?,,,
2065,Claire , It's on the bureau.,,,
2066,Phil , I'm surprised I didn't see it. Where?,,,
2067,Claire ," There, the red envelope.",,,
2068,Phil , It's a... card.,,,
2069,Claire , That's where you're wrong.,,,
2070,Phil , I am so excited. Coupons for... five... free... hugs.,,,
2071,Claire , You don't like it?,,,
2072,Phil ," Are you kidding me? I love it. It's so creative. Coupons for hugs, which are usually free, but this makes it official, which is so great.",,,
2073,Claire , I was so proud of myself when I thought of it because you're impossible to buy for. You never want anything. ,,,
2074,Phil ," Things I want... Robot dog, night-vision goggles, bug vacuum, GPS watch, speakers that look like rocks. I love my wife, but she sucks at giving gifts. I'm sorry for the pay-channel language, but... Yogurt maker. I can't not think of things I want. [OPENING CREDITS]",,,
2075,Cameron , Can't tell if she needs a diaper change.,,,
2076,Mitchell , I think we'd be able to tell.,,,
2077,Cameron ," No, with these diapers, it's hard to tell. Triple leakage protection.",,,
2078,Mitchell , Leak lock... contours to protect her little body.,,,
2079,Cameron , No gapping or chapping.,,,
2080,Mitchell , Do you think that maybe we need a...,,,
2081,Cameron , Night out? Yes.,,,
2082,Mitchell ," Just a few hours with a couple of adults, a few drinks, no baby talk. I think, it'll make us better parents.",,,
2083,Cameron , Stop drilling. You've struck oil. We'll get Gloria to babysit. We're going out.,,,
2084,Mitchell , You got some spittle.,,,
2085,Cameron , Do I? You know who'd be fun to call? Sal.,,,
2086,Mitchell , Sal!,,,
2087,Cameron ," Raise the roof, Lily. We're calling Sal.",,,
2088,Cameron ," Sal is our very best friend in the whole wide world. The reason we love her so much is she has absolutely no inhibitions, and that's before she starts drinking. Hanging out with her is like an Amsterdam Saturday night every day of the week.",,,
2089,Mitchell ," And, ironically, Sal's not allowed back into Amsterdam, any day of the week.",,,
2090,Gloria ," Of course we would love to have the baby, all the other cousins are sleeping over tonight.",,,
2091,Jay ," The more, the merrier.",,,
2092,Gloria , See you tonight. Bye-bye.,,,
2093,Manny , Is Haley still coming? ,,,
2094,Jay , You're related. I will spray you with the hose.,,,
2095,Jay ," All the grandkids are coming over for ""Jay's night."" Family tradition. Everybody wears PJ's, which they love. I make my famous Sloppy Jays, which are really Sloppy Joes, but made by Jay, which they love. And then we watch a western together, which they don't care for, but, hey, it's ""Jay's night.""",,,
2096,Haley ," So, Mom, there's a party tonight at Andrew Adler's, and everybody's gonna be there.",,,
2097,Claire ," Oooh, that sounds like so much fun, but I have other plans.",,,
2098,Haley ," That's high-larious, but I'm talking about me.",,,
2099,Alex , That's unusual.,,,
2100,Claire , You said you'd go to your grandfather's.,,,
2101,Haley ," That's what's so perfect about this. Andrew only lives a couple blocks away from Grandpa, so I figured...",,,
2102,Claire ," Sweetie, you made a commitment.",,,
2103,Haley ," But I really want to go. And plus, every time I go over to Grandpa's, Manny just stares at me the whole time.",,,
2104,Alex , Maybe if you wore a bra.,,,
2105,Claire , Alex...,,,
2106,Alex , What? I can't wait to go to Grandpa's. Family means everything to me.,,,
2107,Haley , Because you have no friends.,,,
2108,Alex ," Because I love Grandpa, and he's getting older. Who knows how many years he has left?",,,
2109,Luke , Is Grandpa dying?,,,
2110,Alex , Didn't they tell you?,,,
2111,Claire ," Alex, stop torturing your brother. No, your grandfather is fine.",,,
2112,Alex , For now.,,,
2113,Phil ," Hmm, who could that be? You expecting someone special?",,,
2114,Claire ," Thank you. Flowers, too?",,,
2115,Phil , I'm sorry.,,,
2116,Claire , What are you apologizing for? They're gorgeous. ,,,
2117,Phil ," It's too much, you know. With the View-Master and the bracelet and the flowers and the balloons.",,,
2118,Claire ,, Balloons?,,
2119,Phil , They're attached to your car. I just don't want you to feel bad about your little... coupons.,,,
2120,Claire , Wait. You thought the coupons were your only present? Are you kidding me?,,,
2121,Phil , They aren't?,,,
2122,Claire ," Phil, come on. It's our anniversary. Those coupons were just like a fun, little way to kick off the day. Your real present is coming tonight, and you're gonna love it. Love it!",,,
2123,Phil , Cool!,,,
2124,Claire , I got nothing. I'm so screwed.,,,
2125,Cameron , This place brings back so many memories.,,,
2126,Sal ," Get in here! Big bear! And my baby cub! Oh, my God! You guys!",,,
2127,Mitchell , Look at you!,,,
2128,Sal , You notice anything different?,,,
2129,Mitchell ," Your hair's longer, right?",,,
2130,Cameron , Did you get your teeth bleached?,,,
2131,Sal , Let me give you a little hint. Ba-boobs!,,,
2132,Mitchell ," Oh, my God! Those are sensational!",,,
2133,Sal , I know. Right? You want to touch 'em?,,,
2134,Mitchell ," I'm gay, not dead. Are you okay with this?",,,
2135,Cameron ," Yeah, you're drinking a passion-fruit daiquiri.",,,
2136,Sal ," Ok, get in there good.",,,
2137,Mitchell , I'm coming in!,,,
2138,Jay ," So, Lily likes that? That... singing?",,,
2139,Gloria , Yes. It relaxes her.,,,
2140,Jay , So Lily's deaf. There are my little stinkers!,,,
2141,Alex ," Hi, grandpa.",,,
2142,Jay , Come on in.,,,
2143,Gloria , Hey! ,,,
2144,Alex , Ola.,,,
2145,Gloria ," Ola, ola!",,,
2146,Manny ," Well, hello, there, Haley.",,,
