,Name,LineA,LineB,LineC,Concatenated
3634,Jay , I'll just put him here for now.,,,
3635,Mitchell , I don't want that.,,,
3636,Cameron , I think he's cute. Let's give him a chance.,,,
3637,Gloria , I came as soon as I heard your message. Did you say that somebody was getting married?,,,
3638,Jay ," Gloria, there you are! I've got good news! What's the matter?",,,
3639,Phil , Honey? Hey. I'm really sorry. That picture was just something that someone sent me. Doesn't matter who. Gil Thorpe. Anyway... I don't do that stuff. You're all the porn I need.,,,
3640,Claire ," That's... Honey, it's fine. It's fine.",,,
3641,Phil , Aah!,,,
3642,Claire , Now it's fine.,,,
3643,Claire , I couldn't care less about the picture. I was just upset when I thought it was Luke.,,,
3644,Claire ," Haley, honey, I really wish you would give me a hand with all this laundry. Never, ever...",,,
3645,Claire ," Haley's off in her own world. Alex has never really been a kid. But Luke is my baby. Is it really too much to ask that he stay a sweet, innocent kid... Forever? ",,,
3646,Phil ," Well, it was a woman on a tractor, And she had her shirt off.",,,
3647,Luke , Was it hot?,,,
3648,Phil ," Okay, we're being honest here. Um... This particular woman... Well, my tastes do run to the curvy, and the cowboy hat did not hurt one bit. Couple that with the cut-off jeans... And you were asking about the weather, weren't you?",,,
3649,Luke , Yeah.,,,
3650,Phil ," Well, this is good. This is good. You're gonna be going through some changes soon, And I think now you can feel safe talking to me about whatever.",,,
3651,Butler ," Sadly, I've been summarily dismissed from the employ of masters Cameron and Mitchell... The former being an utter delight, and the latter being a humorless snoot.",,,
3652,Mitchell ," Just... come on, get him in the car. The thrift shop's closing.",,,
3653,Cmaeron , What is this exciting thrift shop you speak of? Many of my relatives were taken out of their homes to be released into the green pastures in their maturity!,,,
3654,Mitchell ," Did you just say ""maturity""?",,,
3655,Cameron ," Unhand me, you brute! I regret nothing! I'll pay you. I'm a comfortable man. I've been stealing from your father for days. Oh, is there any better feeling in the world than having your ears flap in the wind?",,,
3656,Mitchell , You know what? Get out.,,,
3657,Cameron ," You mean it? Sweet freedom No. No, not you, Barkley. Cameron. Out.",,,
3658,Cameron , Oh. ,,,
3659,Phil ," Hey, buddy. Um... Here, sorry. We'll... we'll dribble later. Um...I just, uh, I just want to say I'm sorry. I never meant to blame you for that whole picture thing. Your mom sort of thought it was yours, And I-I should have stopped it, but I didn't.",,,
3660,Luke , So what was the picture of?  Modern Family,,,
3661,Phil ," Can people change? Well, that's a... tough one that's a tough one but I would say ""yes"", people can change. That's what I believe, anyway. And I will until the day I die.",,,
3662,Claire , You do realize you're proving the exact opposite of your point?,,,
3663,Phil ," See, she's changed. She used to be very supportive about me.",,,
3664,Claire , Come on... Phil!,,,
3665,Phil , Ow! Why is this so loud?,,,
3666,Claire , Why is this so loud? Make it stop.,,,
3667,Phil ," I just installed a sweet home theater system at the family room. The trouble is... Claire struggles with technology. Of any kind. I mean, remotes, cell phones, computers...",,,
3668,Claire ," Haley, have you seen my blue...",,,
3669,Dylan ," Hey, Mrs. Dunphy.",,,
3670,Claire ," Oh, hey, Dylan.",,,
3671,Dylan ," You know I can see you, right?",,,
3672,Claire ," Oh, I did not know that.",,,
3673,Dylan ," Haley is just in the bathroom, she'll be back in just a minute?",,,
3674,Claire , Thank you.,,,
3675,Phil , What are we pointing at?,,,
3676,Claire , At the TV.,,,
3677,Phil ," Honey, no, I'm sorry. It's a home theater.",,,
3678,Claire , What so I - I can't point at the TV when I wanna watch the TV?,,,
3679,Phil , No. You point at the receiver.,,,
3680,Claire , What's a receiver? ,,,
3681,Phil ," Okay, imagine our home theater system is a human body, so, then, the receiver is the brain. The TV is the face.",,,
3682,Claire , I know what part you are...,,,
3683,Jay ," So, he says those lies, and a lot many more. His heart Boom! Quadruple bypass, blow the valve.",,,
3684,Cameron , Hey! Look who it is!,,,
3685,Jay ," Hey, there he is.",,,
3686,Cameron , What a coinkydink. I was just getting some flowers for Gloria for babysitting Lily.,,,
3687,Jay , You want me to take them to her?,,,
3688,Cameron ," I would, But I have the most hilarious card for her at home. It's... it's a hunky Antonio Banderas type in silk boxers, and on the inside it says, ""thank you for last noche... but I can't find my pantalones."" I'm not doing it justice, really. Hi, I'm Cameron.",,,
3689,Jay ," Oh, geez, I'm sorry. Guys, this is Cameron. He's a, um... a ffriend of my son's. This is, uh, Scotty, Dale, Hugo, and Shorty.",,,
3690,Cameron ," It's nice to meet you guys. You guys look like a scene out of ""Jersey boys.""",,,
3691,Gloria ," Ohh, so handsome!",,,
3692,Manny , Thank you.,,,
3693,Gloria ," Manny, are you wearing aftershave?",,,
3694,Manny , Yes. For my date. This will be the first time she will ever smell me.,,,
3695,Manny , Her name is Whitney. I met her in an online book club. We both like vampire fiction and the romance of eternal life.,,,
3696,Gloria ," I think it's adorable that Manny has a date. He even picked out the lunch menu. Grilled-cheese sandwich and tomato soup. Tomato soup because, you know that tomato soup is like the blood and the vampires like to eat their blood. and then he wants me to take them out for ice cream, Well, because Manny likes ice cream. ",,,
3697,Manny ," Oh, that must be her. If this goes well, you don't need to stick around.",,,
3698,Whitney ," Hi, I'm Whitney. I'm here for Manny. [OPENING CREDITS]",,,
3699,Mitchell ,, See how that works?,,
3700,Cameron ," Sorry, sweetie.",,,
3701,Mitchell ," Sorry, daddy. Oh, it's all right. We were just... me and Lily were just using the time to finally figure out how to use the car's voice-command thingy.",,,
3702,Cameron , Oh.,,,
3703,Mitchell ," Yeah, here, Check it out. Watch. Cd player, next track.",,,
3704,System’s voice , Say a command.,,,
3705,Mitchell ," Cd player, next track.",,,
3706,System’s voice , Air conditioner on.,,,
3707,Mitchell , Damn it.,,,
3708,Cameron ," Wow, you're worse than your sister with this kind of stuff. It's a good thing Lily doesn't have an ejector seat. Oh, guess what. I ran into your dad and some of his friends.",,,
3709,Mitchell ," Oh, really?",,,
3710,Cameron ," Yeah. And get this... He, uh, he referred to me as ""a friend of my son.""",,,
3711,Mitchell , Seriously?,,,
3712,Cameron ," Yeah. Well, I wasn't offended by it.",,,
3713,Mitchell ," Well, I am. I mean, w-would he refer to Phil as ""a friend of Claire's?"" no.",,,
3714,Cameron , I've heard him call Phil a lot worse. Just let it pass. I should have never said anything.,,,
3715,Mitchell ," No, I'm not letting it pass. He needs to know that that's not okay. And if he doesn't like it, he knows where he can go.",,,
3716,System’s voice , Enter a destination.,,,
3717,Mitchell , Hell!,,,
3718,System’s voice , Mexican food.,,,
3719,Mitchell , Shut up! ,,,
3720,Mitchell ," I came out of the closet in my mid-20s. I had to actually come out to my dad three times before he finally acknowledged it. I'm not sure if maybe he was hoping he heard it wrong. Like I had said, ""dad, I'm gray.""",,,
3721,Cameron ," And my parents, they always just knew. My mother says labor with me took 36 hours because I came out of the womb like this, ""hello!""",,,
3722,Mitchell ," Hey, dad.",,,
3723,Jay ," Mitchell. Hey, you guys know my son, Mitch.",,,
3724,Guys , Hey.,,,
3725,Shorty ," Hey, Mitch. How's it hanging there, buddy? That's a great coat. Where'd you get that?",,,
3726,Mitchell ," Um, you know, I don't know. It was a gift.",,,
3727,Shorty ," Really? What is it, suede? Microsuede? Some kind of lambskin? It's very soft, you know?",,,
3728,Mitchell ," Thank you. Uh, dad, can I talk to you for a second?",,,
3729,Jay ," Yeah. Yeah, yeah, yeah. Be right back. Good seeing you. What's the matter?",,,
3730,Mitchell ," Um, ""a friend of my son""? That's how you introduce Cam?",,,
3731,Jay , That's why you came here?,,,
3732,Mitchell ," Dad, it's... it's just more than a little insulting. Cam and I have been together for five years. We... we have a daughter.",,,
3733,Jay ," It's... Look at these guys. They look like they came out of the 1800s. You see Hugo over there? After lunch, he ordered a sanka.",,,
3734,Mitchell ," No, they're... they're not the ones that are uncomfortable with this. You are. You... You've never been completely accepting of me and now that I have a family, it's getting a little old.",,,
3735,Jay , These guys don't understand the gay thing. Why create an awkward situation? That's all I'm saying.,,,
3736,Mitchell ," That's weird, because your friend Shorty there... Gay as they come.",,,
3737,Jay , You got to be kidding.,,,
3738,Mitchell ," Mnh, no. My gaydar is never wrong, And it is pinging like we're at a bathhouse. ",,,
3739,Jay ," What are you talking about, gay? The guy used to be married.",,,
3740,Mitchell ," Okay, well, that makes... no, well, so did Elton John, Merv Griffin, Cole Porter...",,,
3741,Jay ," Hey, you know what? You know what? Listen to me. You couldn't be more wrong about this.",,,
3742,Mitchell ," No, dad, you could not be more wrong... about a lot of things. Good seeing you guys.",,,
3743,Guys , Yeah! See you!,,,
3744,Shorty , That's a great coat!,,,
3745,Mitchell , Ping!,,,
3746,Phil , Phil Dunphy.,,,
3747,Claire ," Hey, it's me.",,,
3748,Phil , Hey!,,,
3749,Claire ," Listen, I've got a bunch of moms over here who want to watch the talent-show dvd, and I can't get the sound to work.",,,
3750,Phil , Is there a picture?,,,
3751,Claire , Yes.,,,
3752,Phil , Be honest. Did you do that thing where you get frustrated and you start pressing all the buttons?,,,
3753,Claire , No.,,,
3754,Claire ," I have a theory that Phil installs overly complicated things in the house just so he has an excuse to talk to me like a child. Last month, it was the thermostat.",,,
3755,Phil ," *The snowflake button makes it cold, cold, cold. Set temperature"" makes it hold, hold, hold, the little flame makes it... *",,,
3756,Whitney , This is so humiliating. I am sorry.,,,
3757,Manny , It's okay.,,,
3758,Whitney , He just seemed so mature online. How could I be so stupid?,,,
3759,Manny , You're not stupid. Stupid is not following your heart and taking a chance on love. ,,,
3760,Whitney ," I mean, what kind of 11-year-old talks like that?",,,
3761,Gloria , Manny's an old soul.,,,
3762,Manny ," Here, use my handkerchief.",,,
3763,Gloria , You see what I mean?,,,
3764,Whitney ," I'll just be alone for the rest of my life, and that's okay.",,,
3765,Gloria ," No, don't say that. In my country, there is a saying that means, ""love is just around the corner.""",,,
3766,Gloria , I come from a neighborhood with a lot of prostitutes.,,,
3767,Whitney ," Maybe for you. I mean, men must throw themselves at you every day.",,,
3768,Gloria , They'll do the same for you if you just...,,,
3769,Whitney , Just what? Put out?,,,
3770,Gloria ," No, just... like, the lipstick, the hair, push-up bra, you know.",,,
3771,Whitney , What's it matter? I'm never gonna be as pretty as you.,,,
3772,Gloria ," Believe me, this takes a lot of work. You just need to find your inner beauty.",,,
3773,Manny , It's hiding beneath a mask of insecurity.,,,
3774,Whitney ," Okay, he's starting to freak me out.",,,
3775,Gloria ," Manny, go play.",,,
3776,Manny , Okay.,,,
3777,Cameron ," Mitchell, how do these look to you?",,,
3778,Mitchell , Like they're dying.,,,
3779,Cameron ," I know, right? I said something to the florist, And he said, ""oh, don't worry about it. They're gonna me back."" they're not coming back. They've crossed to the other side!",,,
3780,Mitchell , You are a funny man.,,,
3781,Cameron , Why?,,,
3782,Mitchell ," Well, because you're completely bothered by the flowers, But when my father introduces you as ""a friend of my son""... Doesn't faze you in the least.",,,
3783,Cameron , Because the florist played me for a fool. Your dad didn't mean any harm. He's just being who he is. ,,,
3784,Mitchell ," Uh, when I was back east in law school, my dad used to",,,
3785,call me every Saturday at 6,"00 P.M. Before people would go out, Just, you know, check in, catch up. And then I think the Christmas of my second year, I finally got up the courage to tell him. After that, I-I pretty much just talked to my mom.",,,
3786,Cameron , Don't cry.,,,
3787,Mitchell , I'm not crying.,,,
3788,Jay , I'm home!,,,
3789,Gloria , We're here. This is Whitney. We're giving her a makeover.,,,
3790,Whitney , Hi. You have such a beautiful house.,,,
3791,Jay ," Thanks. Uh, you two know each other how?",,,
3792,Manny , She's my date.,,,
3793,Jay , Of course she is. I'll be in here.,,,
3794,Gloria , I'll be right back.,,,
3795,Manny , I'm sorry this didn't turn out like you wanted.,,,
3796,Whitney ," That's okay. Probably didn't turn out how you wanted it, either.",,,
3797,Manny ," I'll tell you what. If neither of us is with anybody in 10 years, how about you and me give it a shot?",,,
3798,Whitney , That's disturbing... but maybe.,,,
3799,Jay , How was your lunch with the boys?,,,
3800,Jay , Good. Ran into Mitchell and Cam.,,,
3801,Gloria ," Ay, nice.",,,
3802,Jay , And you're not gonna believe this. Mitchell says Shorty's gay.,,,
3803,Gloria ," Shorty? Yeah, I believe it.",,,
3804,Jay ," Oh, come on!",,,
3805,Gloria ," Well, he's a great dresser, a great dancer.",,,
3806,Jay , That doesn't prove anything.,,,
3807,Gloria , And he's the only one of your friends that never hits on me.,,,
3808,Jay , My friends hit on you?,,,
3809,Gloria ," Ah, yes, all the time. But don't worry... They're a bunch of harmless old men. ",,,
3810,Jay , They're my age.,,,
3811,Gloria ," I'm sure it's very hard on Shorty to keep a secret like that. Jay, I think you should talk to him.",,,
3812,Jay , What?,,,
3813,Gloria ," Yeah, you're the only one with a gay son. I'm sure he'll appreciate opening up to you.",,,
3814,Jay ," We're guys. We don't ""open up."" We talk about sports and cars, getting up in the middle of the night to pee.",,,
3815,Gloria , But I'm sure you made it very easy for Mitch to come out of the closet.,,,
3816,Jay , Yeah.,,,
3817,Gloria ," Okay, I'm gonna finish my makeover... 'cause I care about people... Because I want to help them change their lives. Jay, I'm hinting that you should call your friend, okay?",,,
3818,Jay ," Yes, I'm getting that.",,,
3819,Gloria ," Okay, okay.",,,
3820,Phil ," Hey, hey, hey. Daddy in the hiz-ouse!",,,
3821,Phil ," Why would you do that to a brand-new, very expensive remote?",,,
3822,Claire ," Because I lost my temper and it didn't work. Therefore, it's useless.",,,
3823,Phil ," Well, honey, when it comes to anything electronic, you're not exactly the best student.",,,
3824,Claire , I am very smart. I had a 4.0 in college. How about you?,,,
3825,Phil , I was almost that despite my substantial time commitment to cheerleading.,,,
3826,Claire , I thought we agreed not to bring up the cheerleading.,,,
3827,Phil ," Cheerleading in my college was cool. The football players were so jealous, they wouldn't even let me and my buddies Trevor, Scotty, and Ling go to their parties.",,,
3828,Phil ," Seriously, Claire, you owe me an apology for baking that. ",,,
3829,Claire ," Okay. Phil, I apologize for breaking the world's worst remote... That you bought... stupidly.",,,
3830,Phil ," Excuse me, But the experts at cnet.Com rated it the best remote. They gave it three-and-a-half mice.",,,
3831,Claire ," Wow! Well, I have an idea. Let's invite the gang from cnet over and your old buddies from cheerleading And we can have a nerd party.",,,
3832,Phil , Ling is not a nerd. He built his own helicopter. And if he was alive today...,,,
3833,Claire ," Sweetie, let's not talk about ling. It upsets you too much.",,,
3834,Phil , You know what I'm gonna do?,,,
3835,Claire , Hmm?,,,
3836,Phil ," I'm gonna buy a new remote... the same remote. And just to prove how wrong you are, I'm gonna teach our dumbest kid how to use it in 20 minutes or less.",,,
3837,Claire , Who's our dumbest kid?,,,
3838,Phil , Luke.,,,
3839,Claire ," Luke? No, Luke understands electronics. Haley.",,,
3840,Phil , No.,,,
3841,Claire ," Yeah. Haley. Teach Haley to use the remote, and then I'll apologize.",,,
3842,Phil , Haley?,,,
3843,Claire ,, Mm-hmm.,,
3844,Phil , Come on!,,,
3845,Jay," Hey, Shorty.",,,
3846,Jay ," It's me. Uh, I was thinking of heading over to the driving range and hitting a few balls... you want to join me? I don't know. Wear... Wear whatever you want.",,,
3847,Cameron ," Oh, my god. Oh, god.",,,
3848,Mitchell , What?,,,
3849,Cameron , The flowers... they look so much better. This is a disaster.,,,
3850,Mitchell ," You do know what ""disaster"" means, right? ",,,
3851,Cameron , You don't understand. I demanded that they come exchange them. I got all medieval on the florist.,,,
3852,Mitchell ," Cam, I heard you on the phone, you said you were displeased, but that's hardly going medieval.",,,
3853,Cameron ," Excuse me. I said ""very displeased,"" and I used my cowboy voice, so...",,,
3854,Mitchell , W-what are you doing?,,,
3855,Cameron , I'm microwaving them so they look bad again.,,,
3856,Mitchell ," Well, that seems a little crazy, doesn't it?",,,
3857,Cameron ," Oh, no. That's the florist.",,,
3858,Mitchell ," Look, relax. Just take them out. I'll get the door. He'll never know the difference. Hi.",,,
3859,Florist , Florist.,,,
3860,Mitchell ," Hi. Yes, uh, come on in. He's... he's over there with the flowers.",,,
3861,Cameron ," Hello. I don't know what happened. They just, uh, somehow lost their vigor. They were like this when we came home.",,,
3862,Mitchell , Cam. Cam...,,,
3863,Cameron ," Oh, my god! Oh, my god! Oh, my god! Oh! Oh! Oh, god! God! God!",,,
3864,Mitchell , Look at that. Two things flaming at once.,,,
3865,Jay , Damn it!,,,
3866,Shorty , You know what the problem is?,,,
3867,Jay , What?,,,
3868,Shorty , You're not moving your hips. They're frozen.,,,
3869,Jay , Hips?,,,
3870,Shorty ," Yeah, your hips. They're frozen. Here, let me show you.",,,
3871,Jay ," No, it's...",,,
3872,Shorty ," No, no, no, no, no. Don't fight me.",,,
3873,Jay ," All right, Shorty.",,,
3874,Shorty ," Just bring the club back. Go ahead. All right? Now turn those hips. That's it. You just got to relax. You got to open up the stance a little bit. Spad 'em, spread 'em. That's it. That'. If you don't relax, you're never gonna get that shaft where it belongs. ",,,
3875,Jay ," Hey, you know what? How about a coffee? Let's get a coffee.",,,
3876,Shorty , Sure.,,,
3877,Phil ," Now press the button labeled ""activities.""",,,
3878,Haley , Where is that?,,,
3879,Phil ," It's to the right. To the right. And then... and now choose ""watch dvd.""",,,
3880,Haley , What?!,,,
3881,Phil ," Honey, you got to focus. We've only got 20 minutes. Pretend... pretend the mall's closing.",,,
3882,Haley ," Dad, this is stupid. I watch tv on my computer. Why do I have to learn this?",,,
3883,Phil , Because your mom doesn't think you can.,,,
3884,Haley , Nobody can!,,,
3885,Phil ," Haley, listen to me. Listen to me. I know this seems impossible, But this is for all those times that mom told you she was right... And you knew she was wrong.",,,
3886,Haley , I'll do it.,,,
3887,Phil , That's my girl.,,,
3888,Shorty ," You know, that guy's got a beautiful stroke. Look at his pants. No pleats. I like pants like that. You think I can get away with something like that?",,,
3889,Jay ," Sure, why not? Listen, Shorty, uh... We've known each other a long time, right? What, 30 years?",,,
3890,Shorty , Yeah.,,,
3891,Jay ," And, uh... I sense that you got a secret that's maybe causing you a lot of anguish.",,,
3892,Shorty ," You heard something, right?",,,
3893,Jay ," Well, I had the same situation with my son, Mitchell.",,,
3894,Shorty , Really?,,,
3895,Jay ," And I didn't handle it too well, either. And, uh... I just want you to know that you can open up to me, That I'm gonna do all I can to help you. ",,,
3896,Shorty ," Well, I mean, I... I never said this out loud before to anyone, But I guess if I did, it would be you. It's just that, Jay, you see, I'm, uh... ...I'm...",,,
3897,Jay ," Go ahead. Yeah, go ahead.",,,
3898,Shorty , ...I'm in debt.,,,
3899,Jay , Huh?,,,
3900,Shorty ," I owe a bookie 20 g's, and he's a serious guy. And you offering to give me the dough... this is beautiful!",,,
3901,Jay , Wait a minute. You're not gay?,,,
3902,Shorty ," Gay?! What are you talking about, gay? I'm not gay! Where'd you get gay?!",,,
3903,Jay ," Come on, I mean, you're always talking about clothes and everything, right?",,,
3904,Shorty , My father was a tailor. I like clothes. So what? Are you calling my father gay?,,,
3905,Jay , No!,,,
3906,Shorty ," My father landed on Normandy to save your ass. You know, if you weren't lending me 20 g's, I'd knock you out right now.",,,
3907,Jay , Take a check?,,,
3908,Shorty , Cash would be better.,,,
3909,Phil ," Haley, you ready?",,,
3910,Haley , Let's do this.,,,
3911,Claire , Turn on the tv.,,,
3912,Phil , Nice.,,,
3913,Claire , Mute it. Un-mute it. Put it on dvd. Skip forward.,,,
3914,Haley , Wait. Um...,,,
3915,Claire , Okay. Back to tv.,,,
3916,Phil , Face!,,,
3917,Claire ," Don't get all cocky, Phil. Let's see what happens to little Haley when I do this.",,,
3918,Phil , Ho! Ooh!,,,
3919,Claire , Face.,,,
3920,Haley ," Dad, w-what do I do?",,,
3921,Phil , Don't panic. We went through this. Just... just think. ,,,
3922,Claire , Give up? Give up. Admit defeat.,,,
3923,Phil , Haley...,,,
3924,Haley ," Okay, uh, let's see... You put the remote onto tv mode And then pre input till you get hdmi 1 and... Whoo! I did it!",,,
3925,Phil , She did it!,,,
3926,Claire ," Fine, you proved your point. Everybody in this house is smarter than me.",,,
3927,Phil ," No, honey, you're missing the point. I taught Haley how to use the remote in 20 minutes, So think how fast you can learn it.",,,
3928,Haley , What's that supposed to mean?,,,
3929,Phil , See what I'm saying?,,,
3930,Jay ," Mitchell, it's me!",,,
3931,Mitchell ," Hey, dad.",,,
3932,Jay , Hi.,,,
3933,Mitchell , Hi.,,,
3934,Jay , I'm here to let you know your gaydar is broken. Shorty is not gay.,,,
3935,Mitchell ," No. I, um, I knew that. I just, uh... I made that up to mess with you for dissing cam.",,,
3936,Jay ," What? That cost me 20,000 bucks.",,,
3937,Mitchell , What do you mean?,,,
3938,Jay ," I reached out to him, you know, to let him know it's okay to be gay.",,,
3939,Mitchell , You did?,,,
3940,Jay ," Yeah... Right after one of the stranger golf lessons of my life. Turns out what he is is a lousy gambler, And now I'm the one on the hook for it.",,,
3941,Mitchell ," Well, I'm so sorry.",,,
3942,Jay , Then why are you smiling?,,,
3943,Mitchell ," I'm... I'm proud of you, dad. You're growing.",,,
3944,Jay ," Just... just stop it, please? Don't you see how hard this is for me? See, I used to be just like one of those guys. Now look at me. I got a house, looks like little Colombia. I got a gay son and a Chinese granddaughter.",,,
3945,Mitchell , Vietnamese. ,,,
3946,Jay , Only you would know the difference.,,,
3947,Mitchell ," Okay, don't worry, dad. You're not growing too much.",,,
3948,Whitney , I'm a little nervous.,,,
3949,Gloria , Don't be!,,,
3950,Manny , I'm sure you look beautiful. Whoa!,,,
3951,Whitney , What do you think?,,,
3952,Gloria , Look at you!,,,
3953,Whitney , Really?,,,
3954,Gloria , You gonna be fighting men off with a stick! Whitney ; I don't know about that.,,,
3955,Gloria , Cameron!,,,
3956,Cameron ," Hi! Sorry for the pop-over, but I just wanted to bring you these to thank you for babysitting Lily again last night. Gracias. You didn't need to do that. You know I love Lily.",,,
3957,Cameron , I know.,,,
3958,Gloria , Come in. Say hello.,,,
3959,Manny ," Hey, Cam.",,,
3960,Gloria ," Cameron, this is my new friend, Whitney. Whitney, this is Cameron.",,,
3961,Cameron ," Hello, it's nice to meet you. That... is a spectacular dress.",,,
3962,Whitney , This old thing? I don't know...,,,
3963,Gloria , What about her hair?,,,
3964,Cameron ," Oh, my gosh. it's like Barbara Streisand in ""the way we were."" One of my favorites.",,,
3965,Whitney , Me too.,,,
3966,Cameron ," Okay, who is reading ""the forevers""?",,,
3967,Whitney , I am.,,,
3968,Cameron , I am so obsessed with this whole vampire thing right now.,,,
3969,Whitney , Me too!,,,
3970,Whitney , I just met the sweetest guy named Cameron. I think he might be the one. ,,,
3971,Mitchell , Can people change? I don't know. People are who they are... Give or take 15%. That's how much people can change if they really want to.,,,
3972,Jay ," Well, I'll see you when I see you.",,,
3973,Mitchell ," Yeah, thanks for com...",,,
3974,Jay , Okay. ,,,
3975,Jay ," Oh, well, that's a little, um...",,,
3976,Shorty ," Yeah, I thought maybe we could have a little picnic since it's outside, you know? I'll get some nice bottle of wine, a little cheese, lay on a nice blanket, all right?",,,
3977,Jay ," Yeah, fine, yeah.",,,
3978,Shorty ," Yo, hey, I like your hair. Who does your hair?",,,
3979,Man , Huh?,,,
3980,Shorty ," Yo, handsome, who does your hair? ",,,
3981,Claire ," Haley, sweetie, wake up.",,,
3982,Haley , What?,,,
3983,Claire , I need you to teach me to use the tv.,,,
3984,Haley , Now? Why can't dad teach you?,,,
3985,Phil , Because we're married.,,,
3986,Mitchell , Whether it's for themselves or for the people they love.,,,
3987,Claire , That way.,,,
3988,Haley , Yeah. And then press...,,,
